{
  "schema_version": 1,
  "metadata": {
    "title": "Android Release Action Items",
    "as_of": "2026-09-06",
    "source_audit_commit": "ffb995b",
    "source_branch": "pr/apk/develop",
    "purpose": "Authoritative execution-ranked backlog for completing Android QA and a controlled Google Play release.",
    "rank_policy": "Rank is authoritative. Independent owner or infrastructure preparation may start early, but completion is recorded in ranked dependency order.",
    "writer_policy": "orchestrator_only",
    "migration": {
      "legacy_format": "markdown",
      "legacy_blob_commit": "ffb995b",
      "validated_on": "2026-09-04",
      "row_count": 24,
      "field_count": 13,
      "result": "pass",
      "retired": true,
      "recovery_source": "git_history"
    }
  },
  "external_gates": [
    {
      "id": "owner_system_access",
      "title": "Owner and system access for emulator provisioning",
      "status": "satisfied",
      "owner": "Owner",
      "description": "The Lenovo host must expose usable VT-x/KVM, the required SDK components and AVDs, authorized OPPO ADB access, and standard Git repository/status/identity/worktree commands from the Number Garden directory.",
      "completion_criteria": "Every check in docs/runbooks/android-release/preflight.md is evidenced without recording a device serial or other secret.",
      "evidence_paths": ["docs/qa/android-release-qa.md", "/tmp/number-garden-android-preflight-20260906/"],
      "blocker": null,
      "next_action": "Use the provisioned host, authorized OPPO, and three cold-booted AVDs for scoped release QA."
    },
    {
      "id": "artwork_approval",
      "title": "Owner approval of source artwork",
      "status": "waiting_owner",
      "owner": "Owner + Design",
      "description": "The owner must select and explicitly approve the source launcher and splash artwork before native assets are replaced.",
      "completion_criteria": "The approved source files, review evidence, and exact NG-AND-014 acknowledgement are recorded.",
      "evidence_paths": [],
      "blocker": "No approved final source artwork is recorded.",
      "next_action": "Follow docs/runbooks/android-release/owner-actions/ng-and-014-artwork-approval.md."
    }
  ],
  "model_policy": {
    "orchestrator": {
      "model": "gpt-5.6-sol",
      "reasoning_effort": "xhigh",
      "context_window_tokens": 1000000
    },
    "maximum_concurrent_workers": 3,
    "workers": {
      "gpt-5.6-luna": {
        "context_window_tokens": 64000,
        "allowed_reasoning_efforts": ["medium", "high"],
        "routing": "SDK and AVD mechanics, scripted QA preparation, repeated commands, asset checks, and evidence normalization."
      },
      "gpt-5.6-terra": {
        "context_window_tokens": 128000,
        "allowed_reasoning_efforts": ["high", "xhigh"],
        "routing": "Gradle diagnosis, device and WebView QA, policy-link implementation, artwork integration, signing configuration, AAB validation, and Play-delivered QA."
      },
      "gpt-5.6-sol": {
        "context_window_tokens": 256000,
        "allowed_reasoning_efforts": ["xhigh"],
        "routing": "Arithmetic correctness, analytics consent, cross-cutting sign-off, Play policy, release freeze, remediation, and consequential owner gates."
      }
    },
    "escalation_order": ["gpt-5.6-luna", "gpt-5.6-terra", "gpt-5.6-sol"],
    "forbidden_model_families": ["gpt-5.5", "gpt-5.4", "gpt-5", "gpt-4"]
  },
  "orchestration": {
    "mode": "running",
    "baseline_commit": "21daed87706345041dd54a02453332bd3ba8e513",
    "checkpoint_commit": "SELF",
    "checkpoint_history": [
      {
        "commit": "43ef7e34a3b37f8cfb747160b07d229f490513ce",
        "item_id": "NG-AND-001",
        "message": "NG-AND-001: Start Wave 1 investigations",
        "tracker_sha256": "26ef0e562795c5ecccef08d2c4500c60dbb50ba384de8212e0b8408b25e85e85"
      },
      {
        "commit": "f3c52a4f3f6a9e0d91bdbdbc0ebac4ce92df5907",
        "item_id": "NG-AND-002",
        "message": "NG-AND-002: Lease Wave 1 instrumentation resources",
        "tracker_sha256": "b2f676079badde5a31810cdeb887a74c958bc408da5bdc11d6624550d36ac985"
      },
      {
        "commit": "e626cd8eda52f2bd05d63c18a98878dbcf57f21a",
        "item_id": "NG-AND-001",
        "message": "NG-AND-001: Repair worker result handoff",
        "tracker_sha256": "b538fbfed688fc7b9d87c4085687229fc579d916b12875555de4f50906921459"
      },
      {
        "commit": "70212e2b5d8f3dcfd9a4508761c57e927350dbfd",
        "item_id": "NG-AND-001",
        "message": "NG-AND-001: Resume Wave 1 workers",
        "tracker_sha256": "c5acb9b7095abb8841f34f0c9e83fddf90992583cc5c19e58e2c16b22a90df71"
      },
      {
        "commit": "ae47c8e425b13fbb390bf495fcaf8ffb26794673",
        "item_id": "NG-AND-012",
        "message": "NG-AND-012: Refresh owner lane evidence",
        "tracker_sha256": "7d56bf10a7032b4e1afcdf1f8e1e726e66da7f72ea3b7ae179f4d8f9ca5eeada"
      },
      {
        "commit": "7d9b3e2d4be8371df87c6e0abdb8fe7549c3f8c0",
        "item_id": "NG-AND-012",
        "message": "NG-AND-012: Fix owner evidence formatting",
        "tracker_sha256": "935ee9c66c9f952daca1972e8a5c84b74f10d54e3fb32139e2dcb61624295e44"
      }
    ],
    "current_wave": 1,
    "active_workers": [
      {
        "worker_id": "ng-and-001-worker-1",
        "item_id": "NG-AND-001",
        "model": "gpt-5.6-sol",
        "reasoning_effort": "xhigh",
        "worktree_id": "ng-and-001-worktree-1",
        "session_id": "01a075b4-c90c-7ce1-8fb1-d698074a47d2",
        "started_at": "2026-09-06T13:19:07+05:30"
      },
      {
        "worker_id": "ng-and-002-worker-1",
        "item_id": "NG-AND-002",
        "model": "gpt-5.6-terra",
        "reasoning_effort": "high",
        "worktree_id": "ng-and-002-worktree-1",
        "session_id": "01a075b4-c986-7463-8eee-69385388a441",
        "started_at": "2026-09-06T13:19:07+05:30"
      }
    ],
    "worktrees": [
      {
        "id": "ng-and-001-worktree-1",
        "item_id": "NG-AND-001",
        "path": "/tmp/number-garden-android-release-wave1/ng-and-001",
        "branch": "agent/ng-and-001-harness",
        "head_commit": "5c5d1bf6518074b51607f533ce5b7e0d324e906d",
        "state": "active"
      },
      {
        "id": "ng-and-002-worktree-1",
        "item_id": "NG-AND-002",
        "path": "/tmp/number-garden-android-release-wave1/ng-and-002",
        "branch": "agent/ng-and-002-instrumentation",
        "head_commit": "5c5d1bf6518074b51607f533ce5b7e0d324e906d",
        "state": "active"
      },
      {
        "id": "ng-and-003-worktree-1",
        "item_id": "NG-AND-003",
        "path": "/tmp/number-garden-android-release-wave1/ng-and-003",
        "branch": "agent/ng-and-003-consent-analysis",
        "head_commit": "5c5d1bf6518074b51607f533ce5b7e0d324e906d",
        "state": "review"
      }
    ],
    "sessions": [
      {
        "id": "01a075b4-c90c-7ce1-8fb1-d698074a47d2",
        "worker_id": "ng-and-001-worker-1",
        "item_id": "NG-AND-001",
        "state": "running"
      },
      {
        "id": "01a075b4-c986-7463-8eee-69385388a441",
        "worker_id": "ng-and-002-worker-1",
        "item_id": "NG-AND-002",
        "state": "running"
      },
      {
        "id": "01a075b4-c9b4-7aa3-85ef-b22c26ab753e",
        "worker_id": "ng-and-003-worker-1",
        "item_id": "NG-AND-003",
        "state": "completed"
      }
    ],
    "resource_leases": [
      {
        "resource": "heavy_build",
        "holder": "ng-and-002-worker-1",
        "item_id": "NG-AND-002",
        "acquired_at": "2026-09-06T13:21:35+05:30"
      },
      {
        "resource": "oppo_webview",
        "holder": "ng-and-002-worker-1",
        "item_id": "NG-AND-002",
        "acquired_at": "2026-09-06T13:21:35+05:30"
      }
    ],
    "owner_approvals": [],
    "startup_gates": [
      {
        "id": "android_release_preflight",
        "status": "satisfied",
        "runbook": "docs/runbooks/android-release/preflight.md"
      }
    ],
    "blockers": [],
    "next_actions": [
      "Review the concurrent NG-AND-001 and NG-AND-002 worker results and integrate them in rank order.",
      "Review the NG-AND-003 analysis, but do not authorize implementation until NG-AND-001 is integrated.",
      "Finish NG-AND-009 app install/debug verification on the three provisioned AVDs.",
      "Await separate owner acknowledgements for NG-AND-012, NG-AND-013, and NG-AND-014."
    ],
    "remediation": {
      "cycle": 0,
      "trigger_item_id": "NG-AND-023",
      "repeat_item_ids": ["NG-AND-018", "NG-AND-019", "NG-AND-020", "NG-AND-021"],
      "require_version_code_increment": true,
      "history": []
    }
  },
  "items": [
    {
      "rank": 1,
      "id": "NG-AND-001",
      "phase": "Stabilize",
      "severity": "Critical",
      "priority": "P0",
      "play_store_blocker": "required",
      "status": "in_progress",
      "applicability": "always",
      "owner": "Engineering",
      "summary": "Stabilize the deterministic curriculum harness",
      "description": "Reproduce the current quick-drop Tens visibility failure and reconcile it with the prior run that passed that check but failed a later multiplication visibility assertion. Determine whether the defect is product behavior, harness timing, or both; add deterministic coverage and change only canonical source/tests as warranted.",
      "dependencies": [],
      "completion_criteria": "Repeated current-HEAD runs reach `PASS: Number Garden curriculum checks`; affected generated copies are rebuilt/synced; failure/retest details are in the QA report.",
      "evidence_sources": ["`tests/curriculum-harness.html`", "`docs/qa/android-release-qa.md`", "release checklist §1/§3"],